{
 "kind": "semantscript.refund-benchmark-predictions",
 "predictionVersion": 1,
 "benchmark": "refund-decision",
 "datasetSha256": "5d71fc08a357a253a540c44fac35cc85742200f2000e17a3676d548c6a6125ae",
 "support": [
  "approve",
  "deny",
  "review"
 ],
 "system": {
  "role": "ollama-7b",
  "taskSpecSha256": "ffc5c59463a4a9f0cf38e0f6d44d09b1df0e91f13bb9c87a73b049f20c35014c",
  "model": {
   "provider": "ollama",
   "name": "qwen2.5:7b-instruct-q4_K_M",
   "version": "qwen2.5",
   "revision": "845dbda0ea48ed749caafd9e6037047aa19acfcfd82e704d7ca97d631a0b697e",
   "artifactSha256": "2bada8a7450677000f678be90653b85d364de7db25eb5ea54136ada5f3933730"
  },
  "adapter": {
   "name": "refund-ollama-json-schema",
   "version": "2",
   "configurationSha256": "417efcf2d0472e4c90949ff9b749452d582b116637f43d41760a90313054bc61"
  },
  "trainingEvidence": null,
  "executionBackend": {
   "kind": "ollama",
   "serverVersion": "0.34.3",
   "placement": "gpu",
   "modelTotalBytes": 4748056984,
   "modelCpuBytes": 0,
   "modelGpuBytes": 4748056984
  }
 },
 "environment": {
  "capturedAt": "2026-09-23T23:04:02Z",
  "operatingSystem": "Linux 6.18.33.2-microsoft-standard-WSL2",
  "architecture": "x64",
  "cpu": "AMD Ryzen 9 9900X 12-Core Processor x24",
  "accelerator": "AMD Radeon RX 9070 XT (gfx1201, ROCm via WSL2 DXG)",
  "memoryBytes": 16265179136,
  "runtimeVersions": [
   {
    "name": "node",
    "version": "22.22.0"
   },
   {
    "name": "ollama",
    "version": "0.34.3"
   },
   {
    "name": "onnxruntime-node",
    "version": "1.30.0"
   }
  ],
  "evidenceSha256": "ff68c979840129d1b3e4c7eebc481379734912613ff671f088fd54d4b7220172"
 },
 "protocol": {
  "concurrency": 1,
  "warmupIterations": 10,
  "warmupInputOrderSha256": "30bc6f5888a06b90c4f9f01dfdbc938f3457e2ce09830b26f80e56e36b2affd4",
  "measuredDurationMs": 88598.71339499998,
  "memoryScope": "client-only",
  "peakMemoryBytes": 158019584
 },
 "predictions": [
  {
   "caseId": "uci-f-00ced06ee96dca7aff053020",
   "inputSha256": "513ab496209654506b02905c767e018402fd24f05bef8340c0c4eb008a5f2da0",
   "value": "approve",
   "distribution": [
    {
     "value": "approve",
     "probability": 0.95
    },
    {
     "value": "deny",
     "probability": 0.04
    },
    {
     "value": "review",
     "probability": 0.01
    }
   ],
   "latencyMs": 585.4048060000059
  },
  {
   "caseId": "uci-f-00f90a697560793ca6c4e126",
   "inputSha256": "49f96cd2786d1b9ea78f5d26aac7e8b75f78d25b56e390275e2168e9229d33d8",
   "value": "deny",
   "distribution": [
    {
     "value": "approve",
     "probability": 0
    },
    {
     "value": "deny",
     "probability": 1
    },
    {
     "value": "review",
     "probability": 0
    }
   ],
   "latencyMs": 491.21538000000874
  },
  {
   "caseId": "uci-f-00fcd08ec3a811cccf2e6b44",
   "inputSha256": "eab3f1ec6ebebe728ed900cfdade5d042fd41c5430912fffc0b0e0fc157f2c26",
   "value": "approve",
   "distribution": [
    {
     "value": "approve",
     "probability": 0.95
    },
    {
     "value": "deny",
     "probability": 0.04
    },
    {
     "value": "review",
     "probability": 0.01
    }
   ],
   "latencyMs": 580.9086830000015
  },
  {
   "caseId": "uci-f-0102fb5e23908862425679ea",
   "inputSha256": "236e76c92fed4dafbe8e641e24e8c58d111a9954b8e303ca763b5e2bba091b7a",
   "value": "approve",
   "distribution": [
    {
     "value": "approve",
     "probability": 0.95
    },
    {
     "value": "deny",
     "probability": 0.04
    },
    {
     "value": "review",
     "probability": 0.01
    }
   ],
   "latencyMs": 584.8313300000009
  },
  {
   "caseId": "uci-f-01063b311d731718d913c1b0",
   "inputSha256": "f3fc397d2882bd2409c52316dbb69e4523ca82e7876fa3566131962c6d5cfac2",
   "value": "deny",
   "distribution": [
    {
     "value": "approve",
     "probability": 0
    },
    {
     "value": "deny",
     "probability": 1
    },
    {
     "value": "review",
     "probability": 0
    }
   ],
   "latencyMs": 585.8619370000088
  },
  {
   "caseId": "uci-f-0118a559d24e7365d2350114",
   "inputSha256": "eff6c1d81fc0a0d38bd6e6353ead4f457b6d305b1ac01aa51efbd4ac73ac679c",
   "value": "deny",
   "distribution": [
    {
     "value": "approve",
     "probability": 0
    },
    {
     "value": "deny",
     "probability": 1
    },
    {
     "value": "review",
     "probability": 0
    }
   ],
   "latencyMs": 481.024986000004
  },
  {
   "caseId": "uci-f-011a27d0d8b3340153ed477c",
   "inputSha256": "e8fbb6a60b72b23a47a4a66ee0d2c5b23d073cb5aef6c2987cc3b7a34a818f99",
   "value": "approve",
   "distribution": [
    {
     "value": "approve",
     "probability": 0.95
    },
    {
     "value": "deny",
     "probability": 0.04
    },
    {
     "value": "review",
     "probability": 0.01
    }
   ],
   "latencyMs": 580.1963439999963
  },
  {
   "caseId": "uci-f-012d6274ca6f5c44406fe126",
   "inputSha256": "60fd6770ec117e45d1f54daeafc0defd5008290d65e7a60d6b7a5316f6cbffad",
   "value": "approve",
   "distribution": [
    {
     "value": "approve",
     "probability": 0.95
    },
    {
     "value": "deny",
     "probability": 0.04
    },
    {
     "value": "review",
     "probability": 0.01
    }
   ],
   "latencyMs": 576.5582540000032
  },
  {
   "caseId": "uci-f-01631f04a0019d26be94b989",
   "inputSha256": "070c8c60f1dc3b1a06d8852b4a9f5fbe3240ed35922908e3d850229b18b4c7bb",
   "value": "approve",
   "distribution": [
    {
     "value": "approve",
     "probability": 0.95
    },
    {
     "value": "deny",
     "probability": 0.04
    },
    {
     "value": "review",
     "probability": 0.01
    }
   ],
   "latencyMs": 589.705907999989
  },
  {
   "caseId": "uci-f-0166247a8c5ce3c9f1f3f5a6",
   "inputSha256": "963be37a52ce34d2d77d6ea36dac80ababe60705f8d513fbfac6cef0136378e2",
   "value": "approve",
   "distribution": [
    {
     "value": "approve",
     "probability": 0.95
    },
    {
     "value": "deny",
     "probability": 0.04
    },
    {
     "value": "review",
     "probability": 0.01
    }
   ],
   "latencyMs": 608.1998009999952
  },
  {
   "caseId": "uci-f-01685d20435a4f5ee616d554",
   "inputSha256": "b2f8e999d2e695bf1d90f09aea7082f3a2a3b8830e5e70c59d9c2199d215c286",
   "value": "deny",
   "distribution": [
    {
     "value": "approve",
     "probability": 0
    },
    {
     "value": "deny",
     "probability": 1
    },
    {
     "value": "review",
     "probability": 0
    }
   ],
   "latencyMs": 510.2882099999988
  },
  {
   "caseId": "uci-f-0171730cb5e4b26315e24113",
   "inputSha256": "2bb0f11531e983988970dc844d349e2076c0960f73aa8dffa71697bc04b8a4db",
   "value": "approve",
   "distribution": [
    {
     "value": "approve",
     "probability": 0.95
    },
    {
     "value": "deny",
     "probability": 0.04
    },
    {
     "value": "review",
     "probability": 0.01
    }
   ],
   "latencyMs": 591.488486000002
  },
  {
   "caseId": "uci-f-0188600670e922271ff24bff",
   "inputSha256": "27c6ef9453e4f322a645146bd6d1a4232eef45ec47e21ae5d3be0651eb173539",
   "value": "deny",
   "distribution": [
    {
     "value": "approve",
     "probability": 0
    },
    {
     "value": "deny",
     "probability": 1
    },
    {
     "value": "review",
     "probability": 0
    }
   ],
   "latencyMs": 551.7816299999977
  },
  {
   "caseId": "uci-f-019c369052343383753f41e3",
   "inputSha256": "692c528262762d5bd514814d6132e678398e69e7b62aab2087f1dd02c7d2bb82",
   "value": "deny",
   "distribution": [
    {
     "value": "approve",
     "probability": 0
    },
    {
     "value": "deny",
     "probability": 1
    },
    {
     "value": "review",
     "probability": 0
    }
   ],
   "latencyMs": 489.82857400001376
  },
  {
   "caseId": "uci-f-01a9fa0e614e8339bc9a94b2",
   "inputSha256": "832d3272d711475a0d511566d704903ad051f83fb99c8f645e47f17a5e49decc",
   "value": "deny",
   "distribution": [
    {
     "value": "approve",
     "probability": 0
    },
    {
     "value": "deny",
     "probability": 1
    },
    {
     "value": "review",
     "probability": 0
    }
   ],
   "latencyMs": 482.82270800000697
  },
  {
   "caseId": "uci-f-01b2ae27093874a818dbd562",
   "inputSha256": "48f4741ac6386ff73a473c5e7b04551858a484575a331281dfcbb2fe08692edd",
   "value": "deny",
   "distribution": [
    {
     "value": "approve",
     "probability": 0
    },
    {
     "value": "deny",
     "probability": 1
    },
    {
     "value": "review",
     "probability": 0
    }
   ],
   "latencyMs": 486.1207149999973
  },
  {
   "caseId": "uci-f-01c7cb21db260d2652d9972d",
   "inputSha256": "56453b9a2555231ff9eb0f000e8cf0768e0329c053d9ae1f7add6ea9d446a48f",
   "value": "approve",
   "distribution": [
    {
     "value": "approve",
     "probability": 0.9
    },
    {
     "value": "deny",
     "probability": 0.05
    },
    {
     "value": "review",
     "probability": 0.05
    }
   ],
   "latencyMs": 574.9163019999978
  },
  {
   "caseId": "uci-f-01d66e9fc04b26273cf5adea",
   "inputSha256": "292d563bb5541a864900938ba4762edbae52410a1ee2a2055f6da120d0118972",
   "value": "approve",
   "distribution": [
    {
     "value": "approve",
     "probability": 0.95
    },
    {
     "value": "deny",
     "probability": 0.04
    },
    {
     "value": "review",
     "probability": 0.01
    }
   ],
   "latencyMs": 598.354296000005
  },
  {
   "caseId": "uci-f-01d6ceba63dc300d37e05e30",
   "inputSha256": "ca657c02c08845184119f23fbbb44690bb923f52fd67854034c3682f72dad9a4",
   "value": "approve",
   "distribution": [
    {
     "value": "approve",
     "probability": 0.95
    },
    {
     "value": "deny",
     "probability": 0.04
    },
    {
     "value": "review",
     "probability": 0.01
    }
   ],
   "latencyMs": 589.8741040000023
  },
  {
   "caseId": "uci-f-01ddaafe017dab8679c0460e",
   "inputSha256": "12a1e801bc39d2c726d8da905120b58a2a8ba0f56fb413095cc61e3c6a7f251e",
   "value": "deny",
   "distribution": [
    {
     "value": "approve",
     "probability": 0
    },
    {
     "value": "deny",
     "probability": 1
    },
    {
     "value": "review",
     "probability": 0
    }
   ],